{
  "id": "T-10",
  "title": "state.js 생성 (라우팅 상태 getter/setter)",
  "status": "pending",
  "type": "refactor",
  "phase": 2,
  "risk": "low",
  "estimate": "1h",
  "depends_on": ["T-08"],
  "parallel_with": ["T-09"],
  "rollback_checkpoint": null,
  "files": {
    "new": ["packages/web/assets/js/state.js"],
    "modify": [
      "packages/web/assets/js/main.js",
      "packages/web/assets/js/session-detail.js"
    ],
    "delete": []
  },
  "commit_message": "refactor(web): 라우팅 상태를 state.js getter/setter로 통합",
  "verification": {
    "commands": [
      "grep -n \"uiState\\.\" packages/web/assets/js/main.js packages/web/assets/js/session-detail.js",
      "bun test"
    ],
    "checklist": [
      "main.js에 uiState 객체 리터럴 없음 (grep 결과 0줄)",
      "이전된 상태 키 4개: rightView, detailTab, selectedProject, selectedSession",
      "뷰 전환 동작 유지",
      "직접 객체 export 없이 getter/setter만 외부 노출"
    ]
  },
  "rollback_command": null
}
