{
  "id": "T-12",
  "title": "DefaultView 추출",
  "status": "pending",
  "type": "refactor",
  "phase": 3,
  "risk": "medium",
  "estimate": "2.5h",
  "depends_on": ["T-11"],
  "parallel_with": [],
  "rollback_checkpoint": null,
  "files": {
    "new": ["packages/web/assets/js/views/default-view.js"],
    "modify": ["packages/web/assets/js/main.js"],
    "delete": []
  },
  "commit_message": "refactor(web): DefaultView 로직을 views/default-view.js로 분리",
  "verification": {
    "commands": [
      "wc -l packages/web/assets/js/main.js",
      "bun test"
    ],
    "checklist": [
      "main.js 300줄 이하",
      "fetchRequests(loadMore) 이동 확인",
      "prependRequest(r) 이동 확인 (in-place 업데이트 + 스크롤락 로직 포함)",
      "applyFeedSearch() 이동 확인",
      "reapplyFeedAnomalies() 이동 확인",
      "initKeyboardShortcuts() 피드 관련 단축키 이동 확인",
      "setChartMode() 이동 확인",
      "피드 실시간 수신 + in-place 업데이트 동작 확인",
      "feed:updated 이벤트 발행 위치 단일화 확인"
    ]
  },
  "rollback_command": null
}
