{
  "id": "T-18",
  "title": "전체 회귀 검증",
  "status": "pending",
  "type": "test",
  "phase": 5,
  "risk": "low",
  "estimate": "1h",
  "depends_on": ["T-17"],
  "parallel_with": [],
  "rollback_checkpoint": null,
  "files": {
    "new": [],
    "modify": [],
    "delete": []
  },
  "commit_message": "test(web): 전체 회귀 검증 완료",
  "verification": {
    "commands": [
      "bun test",
      "wc -l packages/web/assets/js/main.js",
      "wc -l packages/web/index.html"
    ],
    "checklist": [
      "bun test 전체 통과",
      "T-08의 6개 핵심 시나리오 재확인",
      "main.js 300줄 이하",
      "index.html 200줄 이하",
      "순환 의존 없음: main.js → components → state.js 단방향",
      "activeTypeFilterButtons(), activeSearchInput() 함수 삭제 확인",
      "SUB_TYPES 인라인 배열 request-types.js 외 없음"
    ]
  },
  "rollback_command": null
}
