{
  "id": "T-09a",
  "title": "sse.js 단위 테스트 (MockEventSource)",
  "status": "pending",
  "type": "test",
  "phase": 2,
  "risk": "low",
  "estimate": "1h",
  "depends_on": ["T-09"],
  "parallel_with": ["T-10a"],
  "rollback_checkpoint": null,
  "files": {
    "new": ["packages/web/assets/js/__tests__/sse.test.ts"],
    "modify": [],
    "delete": []
  },
  "commit_message": "test(web): sse.js 연결/재연결/에러 콜백 단위 테스트 추가",
  "verification": {
    "commands": [
      "bun test packages/web/assets/js/__tests__/sse.test.ts"
    ],
    "checklist": [
      "MockEventSource로 네트워크 없이 테스트 통과",
      "연결 성공 → onOpen 호출 확인",
      "new_request 메시지 → onNewRequest 콜백 호출 확인",
      "연결 오류 → onError 호출 + 5초 후 재연결 시도 확인",
      "재연결 후 onOpen 재호출 확인",
      "재연결 타이밍 테스트 포함"
    ]
  },
  "rollback_command": null
}
