{
  "id": "T-08",
  "title": "Phase 1 회귀 검증 (6개 시나리오)",
  "status": "pending",
  "type": "test",
  "phase": 1,
  "risk": "low",
  "estimate": "1h",
  "depends_on": ["T-06", "T-07"],
  "parallel_with": [],
  "rollback_checkpoint": null,
  "files": {
    "new": [],
    "modify": [],
    "delete": []
  },
  "commit_message": "test(web): Phase 1 회귀 검증 통과",
  "verification": {
    "commands": ["bun test"],
    "checklist": [
      "시나리오 1: defaultView 필터 버튼 → 숫자키 1-7 각각 동작",
      "시나리오 2: detailView 필터 버튼 → 숫자키 1-7 각각 동작",
      "시나리오 3: 뷰 전환 후 즉시 숫자키 → 올바른 뷰 필터 적용",
      "시나리오 4: 검색 입력 → 피드 필터링 → ESC 클리어",
      "시나리오 5: detail 검색 입력 → 세션 데이터 필터링 → ESC 클리어",
      "시나리오 6: SSE 수신 중 필터 변경 → 실시간 데이터에 필터 적용 유지",
      "bun test 전체 통과"
    ]
  },
  "rollback_command": null
}
