{
  "id": "T-01",
  "title": "detectAnomalies 단위 테스트",
  "status": "done",
  "type": "test",
  "phase": 0,
  "risk": "low",
  "estimate": "1h",
  "depends_on": [],
  "parallel_with": [],
  "rollback_checkpoint": null,
  "files": {
    "new": ["packages/web/assets/js/__tests__/anomaly.test.ts"],
    "modify": [],
    "delete": []
  },
  "commit_message": "test(web): detectAnomalies 경계값 단위 테스트 추가",
  "verification": {
    "commands": [
      "bun test packages/web/assets/js/__tests__/anomaly.test.ts"
    ],
    "checklist": [
      "spike: 2배 정확히/초과/미달 경계값 통과",
      "loop: 동일 tool 연속 3회 충족/미달 통과",
      "slow: P95 2배 경계값 통과",
      "빈 배열 → 빈 Map 반환 확인",
      "단일 요청 → 이상 없음 확인"
    ]
  },
  "rollback_command": null
}
