{
  "id": "T-15",
  "title": "applyDetailFilter fan-out → detail:filterChanged CustomEvent",
  "status": "pending",
  "type": "refactor",
  "phase": 4,
  "risk": "medium",
  "estimate": "2h",
  "depends_on": ["T-15a"],
  "parallel_with": [],
  "rollback_checkpoint": null,
  "files": {
    "new": [],
    "modify": [
      "packages/web/assets/js/views/detail-view.js",
      "packages/web/assets/js/turn-gantt.js",
      "packages/web/assets/js/session-detail.js",
      "packages/web/assets/js/tool-stats.js",
      "packages/web/assets/js/context-chart.js"
    ],
    "delete": []
  },
  "commit_message": "refactor(web): applyDetailFilter fan-out을 detail:filterChanged CustomEvent로 분해",
  "verification": {
    "commands": ["bun test"],
    "checklist": [
      "applyDetailFilter 내부에 직접 렌더 호출 없음",
      "필터 변경 시 flat/turn/gantt/tools 탭 모두 갱신",
      "setDetailView('gantt') 탭 전환 시 이중 렌더 없음",
      "이벤트 이름은 events.js 상수에서만 참조"
    ]
  },
  "rollback_command": null
}
