{
  "id": "T-11",
  "title": "Phase 2 회귀 검증",
  "status": "pending",
  "type": "test",
  "phase": 2,
  "risk": "low",
  "estimate": "0.5h",
  "depends_on": ["T-09a", "T-10a"],
  "parallel_with": [],
  "rollback_checkpoint": null,
  "files": {
    "new": [],
    "modify": [],
    "delete": []
  },
  "commit_message": "test(web): Phase 2 회귀 검증 통과",
  "verification": {
    "commands": ["bun test"],
    "checklist": [
      "T-08 6개 시나리오 재확인",
      "SSE 연결 중 세션 선택 → detailView + defaultView 양쪽 갱신",
      "빠른 세션 전환 (100ms 간격) → 마지막 세션 데이터만 표시",
      "페이지 새로고침 후 SSE 자동 연결 확인",
      "bun test 전체 통과"
    ]
  },
  "rollback_command": null
}
