{
  "id": "T-15a",
  "title": "events.js 이벤트 상수 SSoT 생성",
  "status": "pending",
  "type": "refactor",
  "phase": 4,
  "risk": "low",
  "estimate": "0.5h",
  "depends_on": ["T-14"],
  "parallel_with": [],
  "rollback_checkpoint": null,
  "files": {
    "new": ["packages/web/assets/js/events.js"],
    "modify": [],
    "delete": []
  },
  "commit_message": "refactor(web): CustomEvent 이름 상수를 events.js SSoT로 추출",
  "verification": {
    "commands": ["bun test"],
    "checklist": [
      "events.js 생성 확인",
      "DETAIL_FILTER_CHANGED, DETAIL_TAB_CHANGED, FEED_UPDATED 상수 포함",
      "모든 이벤트 이름 상수화"
    ]
  },
  "rollback_command": null
}
