{
  "id": "T-03",
  "title": "순수 함수 단위 테스트 (api 파라미터, formatters)",
  "status": "done",
  "type": "test",
  "phase": 0,
  "risk": "low",
  "estimate": "1h",
  "depends_on": ["T-02"],
  "parallel_with": [],
  "rollback_checkpoint": null,
  "files": {
    "new": [
      "packages/web/assets/js/__tests__/api.test.ts",
      "packages/web/assets/js/__tests__/formatters.test.ts"
    ],
    "modify": [],
    "delete": []
  },
  "commit_message": "test(web): api 파라미터 조합, formatters 단위 테스트 추가",
  "verification": {
    "commands": [
      "bun test packages/web/assets/js/__tests__/api.test.ts",
      "bun test packages/web/assets/js/__tests__/formatters.test.ts"
    ],
    "checklist": [
      "dateRange 경계값 테스트 통과",
      "filter 파라미터 조합 테스트 통과",
      "토큰/시간 포맷 경계값 테스트 통과",
      "Phase 0 기준선 확보 완료"
    ]
  },
  "rollback_command": null
}
