{
  "id": "T-17",
  "title": "index.html 다이어트",
  "status": "pending",
  "type": "refactor",
  "phase": 5,
  "risk": "low",
  "estimate": "1h",
  "depends_on": ["T-16"],
  "parallel_with": [],
  "rollback_checkpoint": null,
  "files": {
    "new": [],
    "modify": ["packages/web/index.html"],
    "delete": []
  },
  "commit_message": "refactor(web): index.html 다이어트 — 레이아웃 골격만 유지",
  "verification": {
    "commands": [
      "wc -l packages/web/index.html",
      "grep -c \"<script>\" packages/web/index.html"
    ],
    "checklist": [
      "index.html 200줄 이하",
      "인라인 <script> 블록 0개",
      "필터 버튼 중복 블록 제거 (T-05 자리표시자로 교체됨)",
      "검색 박스 중복 블록 제거 (T-06에서 교체됨)",
      "레이아웃 골격 + script 로드만 유지",
      "페이지 로드 후 모든 뷰 정상 렌더"
    ]
  },
  "rollback_command": null
}
