{
  "id": "T-19",
  "title": "문서 정리 (adr.md, task.json 상태 갱신)",
  "status": "pending",
  "type": "docs",
  "phase": 5,
  "risk": "low",
  "estimate": "0.5h",
  "depends_on": ["T-18"],
  "parallel_with": [],
  "rollback_checkpoint": null,
  "files": {
    "new": [],
    "modify": [
      ".claude/docs/plans/web-refactor/adr.md",
      ".claude/docs/plans/web-refactor/task.json"
    ],
    "delete": []
  },
  "commit_message": "docs(web): 컴포넌트 리팩터링 완료 — ADR/task.json 문서 갱신",
  "verification": {
    "commands": [],
    "checklist": [
      "adr.md 모든 ADR 상태 '결정됨 → 구현 완료' 반영",
      "task.json summary 전체 done 상태 반영"
    ]
  },
  "rollback_command": null
}
